ID;ID;;Name (English);Description (English);Name (Portuguese);Gender;Plural;Article
4817;~X~104817;9;Letterstock;"envelopes, letter cards, plain postcards and correspondence cards, of paper or paperboard; boxes, pouches, wallets and writing compendiums, of paper or paperboard, containing an assortment of paper stationery.";Envelopes;m;1;1
4818;~X~104818;9;Toilet Paper;"toilet paper and similar paper, cellulose wadding or webs of cellulose fibres, of a kind used for household or sanitary purposes, in rolls of a width not exceeding 36 cm, or cut to size or shape; handkerchiefs, cleansing tissues, towels, tablecloths, serv";Papel higiˆnico;m;0;1
4819;~X~104819;9;Paper Containers;"cartons, boxes, cases, bags and other packing containers, of paper, paperboard, cellulose wadding or webs of cellulose fibres; box files, letter trays, and similar articles, of paper or paperboard of a kind used in offices, shops or the like.";Embalagens de papel;m;1;1
4820;~X~104820;9;Paper Notebooks and Binders;registers, account books, note books, order books, receipt books, letter pads, memorandum pads, diaries and similar articles, exercise books, blotting-pads, binders (loose-leaf or other), folders, file covers, manifold business forms, interleaved carbon s;Cadernos e pastas;m;1;1
4821;~X~104821;9;Paper Labels;paper or paperboard labels of all kinds, whether or not printed.;Etiquetas de papel;f;1;1
4822;~X~104822;9;Paper Spools;bobbins, spools, cops and similar supports of paper pulp, paper or paperboard (whether or not perforated or hardened).;Carret‚is e bobinas de papel;m;1;1
4823;~X~104823;9;Shaped Paper;"other paper, paperboard, cellulose wadding and webs of cellulose fibres, cut to size or shape; other articles of paper pulp, paper, paperboard, cellulose wadding or webs of cellulose fibres.";Papel recortado;m;0;1
4901;~X~1049;7;Books;"printed books, newspapers, pictures and other products of the printing industry; manuscripts, typescripts and plans";Livros;m;1;1
4901;~X~104901;9;Brochures;printed books, brochures, leaflets and similar printed matter, whether or not in single sheets.;Brochuras;f;1;1
4902;~X~104902;9;Newspapers;newspapers, journals and periodicals, whether or not illustrated or containing advertising material.;Jornais;m;1;1
4903;~X~104903;9;Children's Picture Books;children's picture, drawing or colouring books.;Livros de ilustra‡äes infantis;m;1;1
4904;~X~104904;9;Sheet Music;music, printed or in manuscript, whether or not bound or illustrated.;M£sica manuscrita ou impressa e partituras;f;0;1
4905;~X~104905;9;Maps and Charts;maps and hydrographic or similar charts of all kinds, including atlases, wall maps, topographical plans and globes, printed.;Obras cartogr ficas;f;1;1
4906;~X~104906;9;Architectural Plans;"plans and drawings for architectural, engineering, industrial, commercial, topographical or similar purposes, being originals drawn by hand; hand-written texts; photographic reproductions on sensitised paper and carbon copies of the foregoing.";Planos e desenhos arquitet“nicos;m;1;1
4907;~X~104907;9;Postage Stamps;"unused postage, revenue or similar stamps of current or new issue in the country in which they have, or will have, a recognised face value; stamp-impressed paper; banknotes; cheque forms; stock, share or bond certificates and similar documents of title.";Selos postais;m;1;1
4908;~X~104908;9;Paper Engraving Transfers;transfers (decalcomanias).;Decalques;m;1;1
4909;~X~104909;9;Postcards;"printed or illustrated postcards; printed cards bearing personal greetings, messages or announcements, whether or not illustrated, with or without envelopes or trimmings.";Cartäes postais;m;1;1
4910;~X~104910;9;Calendars;calendars of any kind, printed, including calendar blocks.;Calend rios;m;1;1
4911;~X~104911;9;Other Printed Material;other printed matter, including printed pictures and photographs.;Outros materiais impressos;m;1;1
50;~X~11;5;Textiles;Textiles And Textile Articles;Artigos tˆxteis;m;1;1
5001;~X~1150;7;Silk;silk;Seda;f;0;1
5001;~X~115001;9;Silkworm Cocoons;silk-worm cocoons suitable for reeling.;Casulos de bicho-da-seda;m;1;1
5002;~X~115002;9;Raw Silk;raw silk (not thrown).;Seda crua;f;0;1
5003;~X~115003;9;Silk Waste;silk waste (including cocoons unsuitable for reeling, yarn waste and garneted stock).;Res¡duos de seda;m;1;1
5004;~X~115004;9;Non-Retail Silk Yarn;silk yarn (other than yarn spun from silk waste) not put up for retail sale.;Fios de seda nÆo acondicionados para venda;m;1;1
5005;~X~115005;9;Silk Waste Yarn;yarn spun from silk waste, not put up for retail sale.;Res¡duos de seda para venda;m;1;1
5006;~X~115006;9;Retail Silk Yarn;"silk yarn and yarn spun from silk waste, put up for retail sale; silk-worm gut.";Fios de seda para venda;m;1;1
5007;~X~115007;9;Silk Fabrics;woven fabrics of silk or of silk waste.;Tecidos de seda;m;1;1
5101;~X~1151;7;Wool and Animal Hair;"wool, fine or coarse animal hair; horsehair yarn and woven fabric";LÆ e fios de crina;f;0;1
5101;~X~115101;9;Wool;wool, not carded or combed.;LÆ;f;0;1
5102;~X~115102;9;Animal Hair;fine or coarse animal hair, not carded or combed.;Fios de crina;m;1;1
5103;~X~115103;9;Wool or Animal Hair Waste;waste of wool or of fine or coarse animal hair, including yarn waste but excluding garnetted stock.;Res¡duos de lÆ e de fios de crina;m;1;1
5104;~X~115104;9;Garnetted Wool or Animal Hair;garnetted stock of wool or of fine or coarse animal hair.;Fiapos de lÆ ou de fios de crina;m;1;1
5105;~X~115105;9;Prepared Wool or Animal Hair;wool and fine or coarse animal hair, carded or combed (including combed wool in fragments).;LÆ e fios de crina preparados;f;0;1
5106;~X~115106;9;Non-Retail Carded Wool Yarn;yarn of carded wool, not put up for retail sale.;Fios de lÆ cardada nÆo acondicionados para venda;m;1;1
5107;~X~115107;9;Non-Retail Combed Wool Yarn;yarn of combed wool, not put up for retail sale.;Fios de lÆ penteada nÆo acondicionados para venda;m;1;1
5108;~X~115108;9;Non-Retail Animal Hair Yarn;yarn of fine animal hair (carded or combed), not put up for retail sale.;Fios de crina nÆo acondicionados para venda;m;1;1
5109;~X~115109;9;Retail Wool or Animal Hair Yarn;yarn of wool or of fine animal hair, put up for retail sale.;Fios de lÆ e de crina para venda;m;1;1
5110;~X~115110;9;Horsehair Yarn;yarn of coarse animal hair or of horsehair (including gimped horsehair yarn), whether or not put up for retail sale.;Fios de crina de equ¡deos;m;1;1
5111;~X~115111;9;Carded Wool or Animal Hair Fabric;woven fabrics of carded wool or of carded fine animal hair.;Tecidos de lÆ ou de crina cardados;m;1;1
5112;~X~115112;9;Combed Wool or Animal Hair Fabric;woven fabrics of combed wool or of combed fine animal hair.;Tecidos de lÆ ou de crina penteados;m;1;1
5113;~X~115113;9;Horsehair Fabric;woven fabrics of coarse animal hair or of horsehair.;Tecido de crina de equ¡deos;m;0;1
5201;~X~1152;7;Cotton;cotton;AlgodÆo;m;0;1
5201;~X~115201;9;Raw Cotton;cotton, not carded or combed.;AlgodÆo cru;m;0;1
5202;~X~115202;9;Cotton Waste;cotton waste (including yarn waste and garnetted stock).;Res¡duos de algodÆo;m;1;1
5203;~X~115203;9;Prepared Cotton;cotton, carded or combed.;AlgodÆo preparado;m;0;1
5204;~X~115204;9;Cotton Sewing Thread;cotton sewing thread, whether or not put up for retail sale.;Linha de algodÆo para costura;f;0;1
5205;~X~115205;9;Non-Retail Pure Cotton Yarn;cotton yarn (other than sewing thread), containing 85 % or more by weight of cotton, not put up for retail sale.;Fios de puro algodÆo nÆo acondicionados;m;1;1
5206;~X~115206;9;Non-Retail Mixed Cotton Yarn;cotton yarn (other than sewing thread), containing less than 85 % by weight of cotton, not put up for retail sale.;Fios de algodÆo misto acondicionados;m;1;1
5207;~X~115207;9;Retail Cotton Yarn;cotton yarn (other than sewing thread) put up for retail sale.;Fios de algodÆo para venda;m;1;1
5208;~X~115208;9;Light Pure Woven Cotton;woven fabrics of cotton, containing 85 % or more by weight of cotton, weighing not more than 200 g/m2.;Tecidos leves de puro algodÆo;m;1;1
5209;~X~115209;9;Heavy Pute Woven Cotton;woven fabrics of cotton, containing 85 % or more by weight of cotton, weighing more than 200 g/m2.;Tecidos pesados de puro algodÆo;m;1;1
5210;~X~115210;9;Light Mixed Woven Cotton;woven fabrics of cotton, containing less than 85 % by weight of cotton, mixed mainly or solely with man-made fibres, weighing not more than 200 g/m2.;Tecidos leves de algodÆo misto;m;1;1
5211;~X~115211;9;Heavy Mixed Woven Cotton;woven fabrics of cotton, containing less than 85 % by weight of cotton, mixed mainly or solely with man-made fibres, weighing more than 200 g/m2.;Tecidos pesados de algodÆo misto;m;1;1
5212;~X~115212;9;Other Cotton Fabrics;other woven fabrics of cotton.;Outros tecidos de algodÆo;m;1;1
5301;~X~1153;7;Textile Fibers;"other vegetable textile fibres; paper yarn and woven fabrics of paper yarn";Fibras tˆxteis;f;1;1
5301;~X~115301;9;Flax Fibers;"flax, raw or processed but not spun; flax tow and waste (including yarn waste and garnetted stock).";Fibras de linho;f;1;1
5302;~X~115302;9;Hemp Fibers;"true hemp (cannabis sativa l.), raw or processed but not spun; tow and waste of true hemp (including yarn waste and garnetted stock).";Fibras de cƒnhamo;f;1;1
5303;~X~115303;9;Jute and Other Textile Fibers;"jute and other textile bast fibres (excluding flax, true hemp and ramie), raw or processed but not spun; tow and waste of these fibres (including yarn waste and garnetted stock).";Juta e outras fibras tˆxteis;f;0;1
5304;~X~115304;9;Agave;Sisal and Agave, raw;Sisal;m;0;1
5305;~X~115305;9;Coconut and Other Vegetable Fibers;"coconut, abaca (manila hemp or musa textilis nee), ramie and other vegetable textile fibres, not elsewhere specified or included, raw or processed but not spun; tow, noils and waste of these fibres (including yarn waste and garnetted stock).";Fibras de coco e outras fibras;f;1;1
5306;~X~115306;9;Flax Yarn;flax yarn.;Fios de linho;m;1;1
5307;~X~115307;9;Jute Yarn;yarn of jute or of other textile bast fibres of heading 53.03.;Fios de juta;m;1;1
5308;~X~115308;9;Other Vegetable Fibers Yarn;"yarn of other vegetable textile fibres; paper yarn.";Outros fios de fibras vegetais;m;1;1
5309;~X~115309;9;Flax Woven Fabric;woven fabrics of flax.;Tecidos de linho;m;1;1
5310;~X~115310;9;Jute Woven Fabric;woven fabrics of jute or of other textile bast fibres of heading 53.03.;Tecidos de juta;m;1;1
5311;~X~115311;9;Other Vegetable Fibers Fabric;"woven fabrics of other vegetable textile fibres; woven fabrics of paper yarn.";Outros tecidos de fibras vegetais;m;1;1
5401;~X~1154;7;Man-Made Filaments;"man-made filaments; strip and the like of man-made textile materials";Filamentos sint‚ticos;m;1;1
5401;~X~115401;9;Artificial Filament Sewing Thread;sewing thread of man-made filaments, whether or not put up for retail sale.;Linhas para costurar de filamentos sint‚ticos;f;1;1
5402;~X~115402;9;Non-Retail Synthetic Filament Yarn;synthetic filament yarn (other than sewing thread), not put up for retail sale, including synthetic monofilament of less than 67 decitex.;Filamentos sint‚ticos nÆo acondicionados;m;1;1
5403;~X~115403;9;Non-Retail Artificial Filament Yarn;artificial filament yarn (other than sewing thread), not put up for retail sale, including artificial monofilament of less than 67 decitex.;Filamentos artificiais nÆo acondicionados;m;1;1
5404;~X~115404;9;Synthetic Monofilament;"synthetic monofilament of 67 decitex or more and of which no cross-sectional dimension exceeds 1 mm; strip and the like (for example, artificial straw) of synthetic textile materials of an apparent width not exceeding 5 mm.";Monofilamentos sint‚ticos;m;1;1
5405;~X~115405;9;Artificial Monofilament;"artificial monofilament of 67 decitex or more and of which no cross-sectional dimension exceeds 1 mm; strip and the like (for example, artificial straw) of artificial textile materials of an apparent width not exceeding 5 mm.";Monofilamentos artificiais;m;1;1
5406;~X~115406;9;Retail Artificial Filament Yarn;man-made filament yarn (other than sewing thread), put up for retail sale.;Filamentos sint‚ticos para venda;m;1;1
5407;~X~115407;9;Synthetic Filament Yarn Woven Fabric;woven fabrics of synthetic filament yarn, including woven fabrics obtained from materials of heading 54.04.;Tecidos de fios de filamentos sint‚ticos;m;1;1
5408;~X~115408;9;Artificial Filament Yarn Woven Fabric;woven fabrics of artificial filament yarn, including woven fabrics obtained from materials of heading 54.05.;Tecidos de fios de filamentos artificiais;m;1;1
5501;~X~1155;7;Artifical Staple Fibers;man-made staple fibres;Fibras sint‚ticas descont¡nuas;f;1;1
5501;~X~115501;9;Synthetic Filament Tow;synthetic filament tow.;Cabos de filamentos sint‚ticos;m;1;1
5502;~X~115502;9;Artificial Filament Tow;artificial filament tow.;Cabos de filamentos artificiais;m;1;1
5503;~X~115503;9;Unprocessed Synthetic Staple Fibers;synthetic staple fibres, not carded, combed or otherwise processed for spinning.;Fibras sint‚ticas descont¡nuas nÆo processadas;f;1;1
5504;~X~115504;9;Unprocessed Artificial Staple Fibers;artificial staple fibres, not carded, combed or otherwise processed for spinning.;Fibras artificiais descont¡nuas nÆo processadas;f;1;1
5505;~X~115505;9;Artificial Fibers Waste;waste (including noils, yarn waste and garnetted stock) of man-made fibres.;Res¡duos de fibras artificiais;m;1;1
5506;~X~115506;9;Processed Synthetic Staple Fibers;synthetic staple fibres, carded, combed or otherwise processed for spinning.;Fibras sint‚ticas descont¡nuas processadas;f;1;1
5507;~X~115507;9;Processed Artificial Staple Fibers;artificial staple fibres, carded, combed or otherwise processed for spinning.;Fibras artificiais descont¡nuas processadas;f;1;1
5508;~X~115508;9;Non-Retail Artificial Staple Fibers Sewing Thread;sewing thread of man-made staple fibres, whether or not put up for retail sale.;Linhas sint‚ticas descont¡nuas para costurar nÆo acondicionadas;f;1;1
5509;~X~115509;9;Non-Retail Synthetic Staple Fibers Yarn;yarn (other than sewing thread) of synthetic staple fibres, not put up for retail sale.;Fios de fibras sint‚ticas descont¡nuas nÆo acondicionados;m;1;1
5510;~X~115510;9;Non-Retail Artificial Staple Fibers Yarn;yarn (other than sewing thread) of artificial staple fibres, not put up for retail sale.;Fios de fibras artificiais descont¡nuas nÆo acondicionados;m;1;1
5511;~X~115511;9;Retail Artificial Staple Fibers Yarn;yarn (other than sewing thread) of man-made staple fibres, put up for retail sale.;Fios de fibras sint‚ticas descont¡nuas para venda;m;1;1
5512;~X~115512;9;Synthetic Fabrics;woven fabrics of synthetic staple fibres, containing 85 % or more by weight of synthetic staple fibres.;Tecidos de fibras sint‚ticas descont¡nuas;m;1;1
5513;~X~115513;9;Light Synthetic Cotton Fabrics;woven fabrics of synthetic staple fibres, containing less than 85 % by weight of such fibres, mixed mainly or solely with cotton, of a weight not exceeding 170 g/m_.;Tecidos leves de fibras sint‚ticas;m;1;1
5514;~X~115514;9;Heavy Synthetic Cotton Fabrics;woven fabrics of synthetic staple fibres, containing less than 85 % by weight of such fibres, mixed mainly or solely with cotton, of a weight exceeding 170 g/m_.;Tecidos pesados de fibras sint‚ticas;m;1;1
5515;~X~115515;9;Other Synthetic Fabrics;other woven fabrics of synthetic staple fibres.;Outros tecidos de fibras sint‚ticas descont¡nuas;m;1;1
5516;~X~115516;9;Artificial Fabrics;woven fabrics of artificial staple fibres.;Tecidos de fibras artificiais descont¡nuas;m;1;1
5601;~X~1156;7;Matted Fabrics and Cordage;"wadding, felt and nonwovens; special yarns; twine, cordage, ropes and cables and articles thereof";Feltros e artigos de cordoaria;m;1;1
5601;~X~115601;9;Wadding;"wadding of textile materials and articles thereof; textile fibres, not exceeding 5 mm in length (flock), textile dust and mill neps.";Pastas de materiais tˆxteis;m;1;1
5602;~X~115602;9;Felt;felt, whether or not impregnated, coated, covered or laminated.;Feltro;m;0;1
5603;~X~115603;9;Non-woven Textiles;nonwovens, whether or not impregnated, coated, covered or laminated.;Falsos tecidos;m;1;1
5604;~X~115604;9;Rubber Textiles;"rubber thread and cord, textile covered; textile yarn, and strip and the like of heading 54.04 or 54.05, impregnated, coated, covered or sheathed with rubber or plastics.";Fios e cordas revestidos de borracha;m;1;1
5605;~X~115605;9;Metallic Yarn;metallised yarn, whether or not gimped, being textile yarn, or strip or the like of heading 54.04 or 54.05, combined with metal in the form of thread, strip or powder or covered with metal.;Fios metalizados;m;1;1
5606;~X~115606;9;Gimp Yarn;"gimped yarn, and strip and the like of heading 54.04 or 54.05, gimped (other than those of heading 56.05 and gimped horsehair yarn); chenille yarn (including flock chenille yarn); loop wale-yarn.";Fios revestidos por enrolamento;m;1;1
5607;~X~115607;9;Twine and Rope;twine, cordage, ropes and cables, whether or not plaited or braided and whether or not impregnated, coated, covered or sheathed with rubber or plastics.;Cord‚is, cordas e cabos;m;1;1
5608;~X~115608;9;Netting;"knotted netting of twine, cordage or rope; made up fishing nets and other made up nets, of textile materials.";Redes de malhas;f;1;1
5609;~X~115609;9;Other Articles of Twine and Rope;articles of yarn, strip or the like of heading 54.04 or 54.05, twine, cordage, rope or cables, not elsewhere specified or included.;Outros artigos de cord‚is, cordas e cabos;m;1;1
5701;~X~1157;7;Carpets;carpets and other textile floor coverings;Tapetes e carpetes;m;1;1
5701;~X~115701;9;Knotted Carpets;carpets and other textile floor coverings, knotted, whether or not made up.;Tapetes de pontos nodados;m;1;1
5702;~X~115702;9;Hand-Woven Rugs;"carpets and other textile floor coverings, woven, not tufted or flocked, whether or not made up, including ""kelem"", ""schumacks"", ""karamanie"" and similar hand-woven rugs.";Tapetes de tecidos … mÆo;m;1;1
5703;~X~115703;9;Tufted Carpets;carpets and other textile floor coverings, tufted, whether or not made up.;Tapetes e carpetes tufados;m;1;1
5704;~X~115704;9;Felt Carpets;carpets and other textile floor coverings, of felt, not tufted or flocked, whether or not made up.;Tapetes e carpetes de feltro;m;1;1
5705;~X~115705;9;Other Carpets;other carpets and other textile floor coverings, whether or not made up.;Outros tapetes e carpetes;m;1;1
5801;~X~1158;7;Special Woven Fabrics;"special woven fabrics; tufted textile fabrics; lace; tapestries; trimmings; embroidery";Tecidos especiais;m;1;1
5801;~X~115801;9;Woven and Chenille Fabrics;woven pile fabrics and chenille fabrics, other than fabrics of heading 58.02 or 58.06.;Tecidos de veludo e pel£cias, chenille;m;1;1
5802;~X~115802;9;Terry Fabric;"terry towelling and similar woven terry fabrics, other than narrow fabrics of heading 58.06; tufted textile fabrics, other than products of heading 57.03.";Tecidos atoalhados;m;1;1
5803;~X~115803;9;Gauze;gauze, other than narrow fabrics of heading 58.06.;Tecidos de gaze;m;1;1
5804;~X~115804;9;Tulles and Net Fabric;"tulles and other net fabrics, not including woven, knitted or crocheted fabrics; lace in the piece, in strips or in motifs, other than fabrics of headings 60.02 to 60.06.";Tules, fil¢ e tecidos de malhas com n¢s;m;1;1
5805;~X~115805;9;Hand-Woven Tapestries;hand-woven tapestries of the type gobelins, flanders, aubusson, beauvais and the like, and needle-worked tapestries (for example, petit point, cross stitch), whether or not made up.;Tape‡arias tecidas … mÆo;f;1;1
5806;~X~115806;9;Narrow Woven Fabric;"narrow woven fabrics, other than goods of heading 58.07; narrow fabrics consisting of warp without weft assembled by means of an adhesive (bolducs).";Fitas;f;1;1
5807;~X~115807;9;Labels;Labels, badges and similar articles of textile materials;Etiquetas;f;1;1
5808;~X~115808;9;Braids;"braids in the piece; ornamental trimmings in the piece, without embroidery, other than knitted or crocheted; tassels, pompons and similar articles.";Tran‡as em pe‡as;f;1;1
5809;~X~115809;9;Metallic Fabric;woven fabrics of metal thread and woven fabrics of metallised yarn of heading 56.05, of a kind used in apparel, as furnishing fabrics or for similar purposes, not elsewhere specified or included.;Tecidos de fios metalizados;m;1;1
5810;~X~115810;9;Embroidery Motifs;embroidery in the piece, in strips or in motifs.;Bordados em tiras ou motivos;m;1;1
5811;~X~115811;9;Quilted Textiles;quilted textile products in the piece, composed of one or more layers of textile materials assembled with padding by stitching or otherwise, other than embroidery of heading 58.10.;Artefatos tˆxteis em matelassˆs;m;1;1
5901;~X~1159;7;Coated Textile Fabric;"impregnated, coated, covered or laminated textile fabrics; textile articles of a kind suitable for industrial use";Tecidos revestidos ou estratificados;m;1;1
5901;~X~115901;9;Gum Coated Textile Fabric;"textile fabrics coated with gum or amylaceous substances, of a kind used for the outer covers of books or the like; tracing cloth; prepared painting canvas; buckram and similar stiffened textile fabrics of a kind used for hat foundations.";Tecidos revestidos de cola;m;1;1
5902;~X~115902;9;Polyamide Fabric;tyre cord fabric of high tenacity yarn of nylon or other polyamides, polyesters or viscose rayon.;Telas de poliamidas;f;1;1
5903;~X~115903;9;Plastic Coated Textile Fabric;textile fabrics impregnated, coated, covered or laminated with plastics, other than those of heading 59.02.;Tecidos revestidos com pl stico;m;1;1
5904;~X~115904;9;Linoleum;"linoleum, whether or not cut to shape; floor coverings consisting of a coating or covering applied on a textile backing, whether or not cut to shape.";Lin¢leos;m;1;1
5905;~X~115905;9;Textile Wall Coverings;textile wall coverings.;Revestimentos tˆxteis para paredes;m;1;1
5906;~X~115906;9;Rubber Textile Fabric;rubberised textile fabrics, other than those of heading 59.02.;Tecidos com borracha;m;1;1
5907;~X~115907;9;Coated Textile Fabric;"textile fabrics otherwise impregnated, coated or covered; painted canvas being theatrical scenery, studio back-cloths or the like.";Outros tecidos revestidos;m;1;1
5908;~X~115908;9;Textile Wicks;"textile wicks, woven, plaited or knitted , for lamps, stoves, lighters, candles or the like; incandescent gas mantles and tubular knitted gas mantle fabric therefor, whether or not impregnated.";Mechas de materiais tˆxteis;f;1;1
5909;~X~115909;9;Hosepiping Textiles;textile hosepiping and similar textile tubing, with or without lining, armour or accessories of other materials.;Mangueiras e tubos de materiais tˆxteis;f;1;1
5910;~X~115910;9;Conveyor Belt Textiles;transmission or conveyor belts or belting, of textile material, whether or not impregnated, coated, covered or laminated with plastics, or reinforced with metal or other material.;Correias de materiais tˆxteis;f;1;1
5911;~X~115911;9;Technical Use Textiles;textile products and articles, for technical uses, specified in note 7 to this chapter.;Produtos tˆxteis para usos t‚cnicos;m;1;1
6001;~X~1160;7;Knit Fabric;knitted or crocheted fabrics;Tecidos de malha;m;1;1
6001;~X~116001;9;Pile Fabric;"pile fabrics, including ""long pile"" fabrics and terry fabrics, knitted or crocheted.";Veludos e pel£cias de malha;m;1;1
6002;~X~116002;9;Light Rubberized Knitted Fabric;knitted or crocheted fabrics of a width not exceeding 30 cm, containing by weight 5 % or more of elastomeric yarn or rubber thread, other than those of heading 60.01.;Tecidos leves de malha de borracha;m;1;1
6003;~X~116003;9;Other Light Knitted Fabric;knitted or crocheted fabrics of a width not exceeding 30 cm, other than those of heading 60.01 or 60.02.;Outros tecidos de malha leve;m;1;1
6004;~X~116004;9;Heavy Rubberized Knitted Fabric;knitted or crocheted fabrics of a width exceeding 30 cm, containing by weight 5 % or more of elastomeric yarn or rubber thread, other than those of heading 60.01.;Tecidos pesados de malha de borracha;m;1;1
6005;~X~116005;9;Warp Knit Fabrics;warp knit fabrics (including those made on galloon knitting machines), other than those of headings 60.01 to 60.04.;Tecidos de malha-urdidura;m;1;1
6006;~X~116006;9;Other Knit Fabric;other knitted or crocheted fabrics.;Outros tecidos de malha;m;1;1
6101;~X~1161;7;Knit Apparel and Accessories;articles of apparel and clothing accessories, knitted or crocheted;Vestu rio de malha e acess¢rios;m;0;1
6101;~X~116101;9;Knit Men's Coats;men's or boys' overcoats, car-coats, capes, cloaks, anoraks (including ski-jackets), wind-cheaters, wind-jackets and similar articles, knitted or crocheted, other than those of heading 61.03.;Sobretudos e casacos masculinos de malha;m;1;1
6102;~X~116102;9;Knit Women's Coats;women's or girls' overcoats, car-coats, capes, cloaks, anoraks (including ski-jackets), wind-cheaters, wind- jackets and similar articles, knitted or crocheted, other than those of heading 61.04.;Sobretudos e casacos femininos de malha;m;1;1
6103;~X~116103;9;Knit Men's Suits;men's or boys' suits, ensembles, jackets, blazers, trousers, bib and brace overalls, breeches and shorts (other than swimwear), knitted or crocheted.;Ternos e roupas masculinas de malha;m;1;1
6104;~X~116104;9;Knit Women's Suits;women's or girls' suits, ensembles, jackets, blazers, dresses, skirts, divided skirts, trousers, bib and brace overalls, breeches and shorts (other than swimwear), knitted or crocheted.;Tailleurs e roupas femininas de malha;m;1;1
6105;~X~116105;9;Knit Men's Shirts;men's or boys' shirts, knitted or crocheted.;Camisas masculinas de malha;f;1;1
6106;~X~116106;9;Knit Women's Shirts;women's or girls' blouses, shirts and shirt-blouses, knitted or crocheted.;Camisas femininas de malha;f;1;1
