ID;ID;;Name (English);Description (English);Name (Portuguese);Gender;Plural;Article
8401;~X~168401;9;Nuclear Reactors;"nuclear reactors; fuel elements (cartridges), non-irradiated, for nuclear reactors; machinery and apparatus for isotopic separation.";Reatores nucleares;m;1;1
8402;~X~168402;9;Steam Boilers;"steam or other vapour generating boilers (other than central heating hot water boilers capable also of producing low pressure steam); super-heated water boilers.";Caldeiras de vapor;f;1;1
8403;~X~168403;9;Central Heating Boilers;central heating boilers other than those of heading 84.02.;Caldeiras para aquecimento central;f;1;1
8404;~X~168404;9;Boiler Plants;"auxiliary plant for use with boilers of heading 84.02 or 84.03 (for example, economisers, super-heaters, soot removers, gas recoverers); condensers for steam or other vapour power units.";Aparelhos auxiliares para caldeiras;m;1;1
8405;~X~168405;9;Water and Gas Generators;"producer gas or water gas generators, with or without their purifiers; acetylene gas generators and similar water process gas generators, with or without their purifiers.";Geradores de g s de ar ou  gua;m;1;1
8406;~X~168406;9;Steam Turbines;steam turbines and other vapour turbines.;Turbinas a vapor;f;1;1
8407;~X~168407;9;Spark-Ignition Engines;spark-ignition reciprocating or rotary internal combustion piston engines.;Motores de igni‡Æo por centelha;m;1;1
8408;~X~168408;9;Combustion Engines;compression-ignition internal combustion piston engines (diesel or semi-diesel engines).;Motores de igni‡Æo por compressÆo;m;1;1
8409;~X~168409;9;Engine Parts;parts suitable for use solely or principally with the engines of heading 84.07 or 84.08.;Pe‡as para motores;f;1;1
8410;~X~168410;9;Hydraulic Turbines;hydraulic turbines, water wheels, and regulators therefor.;Turbinas hidr ulicas;f;1;1
8411;~X~168411;9;Gas Turbines;turbo-jets, turbo-propellers and other gas turbines.;Turbinas a g s;f;1;1
8412;~X~168412;9;Other Engines;other engines and motors.;Outros motores;m;1;1
8413;~X~168413;9;Liquid Pumps;"pumps for liquids, whether or not fitted with a measuring device; liquid elevators.";Bombas para l¡quidos;f;1;1
8414;~X~168414;9;Air Pumps;"air or vacuum pumps, air or other gas compressors and fans; ventilating or recycling hoods incorporating a fan, whether or not fitted with filters.";Bombas de ar;f;1;1
8415;~X~168415;9;Air Conditioners;air conditioning machines, comprising a motor-driven fan and elements for changing the temperature and humidity, including those machines in which the humidity cannot be separately regulated.;Condicionadores de ar;m;1;1
8416;~X~168416;9;Liquid Fuel Furnaces;"furnace burners for liquid fuel, for pulverised solid fuel or for gas; mechanical stokers, including their mechanical grates, mechanical ash dischargers and similar appliances.";Fornalhas de combust¡veis l¡quidos;f;1;1
8417;~X~168417;9;Industrial Furnaces;industrial or laboratory furnaces and ovens, including incinerators, non-electric.;Fornos industriais;m;1;1
8418;~X~168418;9;Refrigerators;"refrigerators, freezers and other refrigerating or freezing equipment, electric or other; heat pumps other than air conditioning machines of heading 84.15.";Refrigeradores;m;1;1
8419;~X~168419;9;Other Heating Machinery;machinery, plant or laboratory equipment, whether or not electrically heated (excluding furnaces, ovens and other equipment of heading 85.14), for the treatment of materials by a process involving a change of temperature such as heating, cooking, roasting;Outros maquin rios de aquecimento;m;1;1
8420;~X~168420;9;Rolling Machines;calendering or other rolling machines, other than for metals or glass, and cylinders therefor.;M quinas laminadoras;f;1;1
8421;~X~168421;9;Centrifuges;"centrifuges, including centrifugal dryers; filtering or purifying machinery and apparatus, for liquids or gases.";Centr¡fugas;f;1;1
8422;~X~168422;9;Washing and Bottling Machines;"dish washing machines; machinery for cleaning or drying bottles or other containers; machinery for filling, closing, sealing or labelling bottles, cans, boxes, bags or other containers; machinery for capsuling bottles, jars, tubes and similar containers;";M quinas lavadoras e envasadoras;f;1;1
8423;~X~168423;9;Scales;"weighing machinery (excluding balances of a sensitivity of 5 cg or better), including weight operated counting or checking machines; weighing machine weights of all kinds.";Balan‡as;f;1;1
8424;~X~168424;9;Liquid Dispersing Machines;"mechanical appliances (whether or not hand-operated) for projecting, dispersing or spraying liquids or powders; fire extinguishers, whether or not charged; spray guns and similar appliances; steam or sand blasting machines and similar jet projecting machi";M quinas para pulveriza‡Æo;f;1;1
8425;~X~168425;9;Pulley Systems;"pulley tackle and hoists other than skip hoists; winches and capstans; jacks.";Sistemas de polias;f;1;1
8426;~X~168426;9;Cranes;"ships' derricks; cranes, including cable cranes; mobile lifting frames, straddle carriers and works trucks fitted with a crane.";Guindastes;m;1;1
8427;~X~168427;9;Fork-Lifts;"fork-lift trucks; other works trucks fitted with lifting or handling equipment.";Empilhadeiras;f;1;1
8428;~X~168428;9;Lifting Machinery;other lifting, handling, loading or unloading machinery (for example, lifts, escalators, conveyors, teleferics).;Outros maquin rios para eleva‡Æo;m;1;1
8429;~X~168429;9;Large Construction Vehicles;self-propelled bulldozers, angledozers, graders, levellers, scrapers, mechanical shovels, excavators, shovel loaders, tamping machines and road rollers.;Ve¡culos de grande porte para constru‡Æo;m;1;1
8430;~X~168430;9;Other Construction Vehicles;"other moving, grading, levelling, scraping, excavating, tamping, compacting, extracting or boring machinery, for earth, minerals or ores; pile-drivers and pile-extractors; snow-ploughs and snow-blowers.";Outros ve¡culos para constru‡Æo;m;1;1
8431;~X~168431;9;Excavation Machinery;parts suitable for use solely or principally with the machinery of headings 84.25 to 84.30.;Maquin rio para escava‡Æo;m;0;1
8432;~X~168432;9;Soil Preparation Machinery;"agricultural, horticultural or forestry machinery for soil preparation or cultivation; lawn or sports-ground rollers.";Maquin rio para prepara‡Æo do solo;m;0;1
8433;~X~168433;9;Harvesting Machinery;"harvesting or threshing machinery, including straw or fodder balers; grass or hay mowers; machines for cleaning, sorting or grading eggs, fruit or other agricultural produce, other than machinery of heading 84.37.";Colheitadeiras;f;1;1
8434;~X~168434;9;Dairy Machinery;milking machines and dairy machinery.;Maquin rios para derivados do leite;m;1;1
8435;~X~168435;9;Fruit Pressing Machinery;presses, crushers and similar machinery used in the manufacture of wine, cider, fruit juices or similar beverages.;Maquin rios para processamento de frutas;m;1;1
8436;~X~168436;9;Other Agricultural Machinery;"other agricultural, horticultural, forestry, poultry-keeping or bee-keeping machinery, including germination plant fitted with mechanical or thermal equipment; poultry incubators and brooders.";Outros maquin rios agropecu rios;m;1;1
8437;~X~168437;9;Mill Machinery;"machines for cleaning, sorting or grading seed, grain or dried leguminous vegetables; machinery used in the milling industry or for the working of cereals or dried leguminous vegetables, other than farm-type machinery.";Moinhos;m;1;1
8438;~X~168438;9;Other Food Machinery;machinery, not specified or included elsewhere in this chapter, for the industrial preparation or manufacture of food or drink, other than machinery for the extraction or preparation of animal or fixed vegetable fats or oils.;Outros maquin rios para alimentos;m;1;1
8439;~X~168439;9;Papermaking Machines;machinery for making pulp of fibrous cellulosic material or for making or finishing paper or paperboard.;M quinas para produ‡Æo de papel;f;1;1
8440;~X~168440;9;Book-binding Machines;book-binding machinery, including book-sewing machines.;M quinas para encaderna‡Æo de livros;f;1;1
8441;~X~168441;9;Other Paper Machinery;other machinery for making up paper pulp, paper or paperboard, including cutting machines of all kinds.;Outros maquin rios para papel;m;1;1
8442;~X~168442;9;Print Production Machinery;"machinery, apparatus and equipment (other than the machine-tools of headings 84.56 to 84.65) for preparing or making plates, cylinders or other printing components; plates, cylinders and other printing components; plates, cylinders and lithographic stones";Maquin rios da produ‡Æo gr fica;m;1;1
8443;~X~168443;9;Industrial Printers;"printing machinery used for printing by means of plates, cylinders and other printing components of heading 84.42; other printers, copying machines and facsimile machines, whether or not combined; parts and accessories thereof.";Impressoras industriais;f;1;1
8444;~X~168444;9;Artificial Textile Machinery;machines for extruding, drawing, texturing or cutting man-made textile materials.;Maquin rios para tˆxteis artificiais;m;1;1
8445;~X~168445;9;Textile Fiber Machinery;"machines for preparing textile fibres; spinning, doubling or twisting machines and other machinery for producing textile yarns; textile reeling or winding (including weft-winding) machines and machines for preparing textile yarns for use on the machines o";Maquin rios para fibras tˆxteis;m;1;1
8446;~X~168446;9;Looms;weaving machines (looms).;Teares;m;1;1
8447;~X~168447;9;Knitting Machines;knitting machines, stitch-bonding machines and machines for making gimped yarn, tulle, lace, embroidery, trimmings, braid or net and machines for tufting.;M quinas de tric“;f;1;1
8448;~X~168448;9;Knitting Machine Accessories;"auxiliary machinery for use with machines of heading 84.44, 84.45, 84.46 or 84.47 (for example, dobbies, jacquards, automatic stop motions, shuttle changing mechanisms); parts and accessories suitable for use solely or principally with the machines of thi";Acess¢rios de m quinas de tric“;m;1;1
8449;~X~168449;9;Felt Machinery;"machinery for the manufacture or finishing of felt or nonwovens in the piece or in shapes, including machinery for making felt hats; blocks for making hats.";Maquin rios para feltros;m;1;1
8450;~X~168450;9;Household Washing Machines;household or laundry-type washing machines, including machines which both wash and dry.;M quinas de lavar dom‚sticas;f;1;1
8451;~X~168451;9;Textile Processing Machines;machinery (other than machines of heading 84.50) for washing, cleaning, wringing, drying, ironing, pressing (including fusing presses), bleaching, dyeing, dressing, finishing, coating or impregnating textile yarns, fabrics or made up textile articles and;M quinas para processamento de tˆxteis;f;1;1
8452;~X~168452;9;Sewing Machines;"sewing machines, other than book-sewing machines of heading 84.40; furniture, bases and covers specially designed for sewing machines; sewing machine needles.";M quinas de costurar;f;1;1
8453;~X~168453;9;Leather Machinery;machinery for preparing, tanning or working hides, skins or leather or for making or repairing footwear or other articles of hides, skins or leather, other than sewing machines.;Maquin rios para couro;m;1;1
8454;~X~168454;9;Casting Machines;converters, ladles, ingot moulds and casting machines, of a kind used in metallurgy or in metal foundries.;Maquin rios para fundi‡Æo;m;1;1
8455;~X~168455;9;Metal-Rolling Mills;metal-rolling mills and rolls therefor.;Laminadores de metais;m;1;1
8456;~X~168456;9;Laser Removal Machines;machine-tools for working any material by removal of material, by laser or other light or photon beam, ultrasonic, electro-discharge, electro-chemical, electron beam, ionic-beam or plasma arc processes.;M quinas para elimina‡Æo por laser;f;1;1
8457;~X~168457;9;Metalworking Transfer Machines;machining centres, unit construction machines (single station) and multi-station transfer machines, for working metal.;M quinas para usinagem de metais;f;1;1
8458;~X~168458;9;Metal Lathes;lathes (including turning centres) for removing metal.;Tornos;m;1;1
8459;~X~168459;9;Drilling Machines;machine-tools (including way-type unit head machines) for drilling, boring, milling, threading or tapping by removing metal, other than lathes (including turning centres) of heading 84.58.;Furadeiras;f;1;1
8460;~X~168460;9;Metal Finishing Machines;machine-tools for deburring, sharpening, grinding, honing, lapping, polishing or otherwise finishing metal or cermets by means of grinding stones, abrasives or polishing products, other than gear cutting, gear grinding or gear finishing machines of headin;M quinas de acabamento em metais;f;1;1
8461;~X~168461;9;Metalworking Machines;machine-tools for planing, shaping, slotting, broaching, gear cutting, gear grinding or gear finishing, sawing, cutting-off and other machine-tools working by removing metal or cermets, not elsewhere specified or included.;M quinas de moldagem de metais;f;1;1
8462;~X~168462;9;Forging Machines;"machine-tools (including presses) for working metal by forging, hammering or die-stamping; machine-tools (including presses) for working metal by bending, folding, straightening, flattening, shearing, punching or notching; presses for working metal or met";M quinas de forja;f;1;1
8463;~X~168463;9;Other Non-removal Metalworking Machines;other machine-tools for working metal or cermets, without removing material.;Outras m quinas para metais;f;1;1
8464;~X~168464;9;Stoneworking Machines;machine-tools for working stone, ceramics, concrete, asbestos-cement or like mineral materials or for cold working glass.;M quinas para trabalhar pedras;f;1;1
8465;~X~168465;9;Woodworking machines;machine-tools (including machines for nailing, stapling, glueing or otherwise assembling) for working wood, cork, bone, hard rubber, hard plastics or similar hard materials.;M quinas para trabalhar madeiras;f;1;1
8466;~X~168466;9;Metalworking Machine Parts;"parts and accessories suitable for use solely or principally with the machines of headings 84.56 to 84.65, including work or tool holders, self-opening dieheads, dividing heads and other special attachments for machine-tools; tool holders for any type of";Pe‡as de m quinas para metais;f;1;1
8467;~X~168467;9;Motor-working Tools;tools for working in the hand, pneumatic, hydraulic or with self-contained electric or non-electric motor.;Ferramentas para trabalhar motores;f;1;1
8468;~X~168468;9;Soldering and Welding Machinery;"machinery and apparatus for soldering, brazing or welding, whether or not capable of cutting, other than those of heading 85.15; gas-operated surface tempering machines and appliances.";Maquin rios e equipamentos de solda;m;1;1
8469;~X~168469;9;Typewriters;"typewriters other than printers of heading 84.43; word-processing machines.";M quinas de escrever;f;1;1
8470;~X~168470;9;Calculators;"calculating machines and pocket-size data recording, reproducing and displaying machines with calculating functions; accounting machines, postage-franking machines, ticket-issuing machines and similar machines, incorporating a calculating device; cash reg";Calculadoras;f;1;1
8471;~X~168471;9;Digital Disk Drives;"automatic data processing machines and units thereof; magnetic or optical readers, machines for transcribing data onto data media in coded form and machines for processing such data, not elsewhere specified or included.";Discos para grava‡Æo de dados digitais;m;1;1
8472;~X~168472;9;Other Office Machines;other office machines (for example, hectograph or stencil duplicating machines, addressing machines, automatic banknote dispensers, coin-sorting machines, coin-counting or wrapping machines, pencil-sharpening machines, perforating or stapling machines).;Outras m quinas de escrit¢rio;f;1;1
8473;~X~168473;9;Office Machine parts;parts and accessories (other than covers, carrying cases and the like) suitable for use solely or principally with machines of headings 84.69 to 84.72.;Pe‡as para m quinas de escrit¢rio;f;1;1
8474;~X~168474;9;Stone Processing Machines;"machinery for sorting, screening, separating, washing, crushing, grinding, mixing or kneading earth, stone, ores or other mineral substances, in solid (including powder or paste) form; machinery for agglomerating, shaping or moulding solid mineral fuels,";Maquinas para processar rochas;f;1;1
8475;~X~168475;9;Glassworking Machines;"machines for assembling electric or electronic lamps, tubes or valves or flashbulbs, in glass envelopes; machines for manufacturing or hot working glass or glassware.";M quinas para trabalhar vidro;f;1;1
8476;~X~168476;9;Vending Machines;automatic goods-vending machines (for example, postage stamp, cigarette, food or beverage machines), including money-changing machines.;M quinas de vendas automatizadas;f;1;1
8477;~X~168477;9;Rubberworking Machinery;machinery for working rubber or plastics or for the manufacture of products from these materials, not specified or included elsewhere in this chapter.;M quinas para o processamento de borracha;f;1;1
8478;~X~168478;9;Tobacco Processing Machines;machinery for preparing or making up tobacco, not specified or included elsewhere in this chapter.;M quinas para processar tabaco;f;1;1
8479;~X~168479;9;Other Machinery;machines and mechanical appliances having individual functions, not specified or included elsewhere in this chapter.;Outros maquin rios;m;1;1
8480;~X~168480;9;Metal Molds;"moulding boxes for metal foundry; mould bases; moulding patterns; moulds for metal (other than ingot moulds), metal carbides, glass, mineral materials, rubber or plastics.";Caixas de fundi‡Æo;f;1;1
8481;~X~168481;9;Valves;taps, cocks, valves and similar appliances for pipes, boiler shells, tanks, vats or the like, including pressure-reducing valves and thermostatically controlled valves.;V lvulas;f;1;1
8482;~X~168482;9;Ball Bearings;ball or roller bearings.;Rolamentos de esferas;m;1;1
8483;~X~168483;9;Transmissions;"transmission shafts (including cam shafts and crank shafts) and cranks; bearing housings and plain shaft bearings; gears and gearing; ball or roller screws; gear boxes and other speed changers, including torque converters; flywheels and pulleys, including";Transmissäes;m;1;1
8484;~X~168484;9;Gaskets;"gaskets and similar joints of metal sheeting combined with other material or of two or more layers of metal; sets or assortments of gaskets and similar joints, dissimilar in composition, put up in pouches, envelopes or similar packings; mechanical seals.";Juntas de veda‡Æo;f;1;1
8485;~X~168485;9;Boat Propellers;Ships or boats propellers and blades;H‚lices n uticas;f;1;1
8486;~X~168486;9;Semiconductor Machinery;"machines and apparatus of a kind used solely or principally for the manufacture of semiconductor boules or wafers, semiconductor devices, electronic integrated circuits or flat panel displays; machines and apparatus specified in note 9 (c) to this chapter";Maquin rio para semicondutores;m;0;1
8487;~X~168487;9;Other Machinery Parts;machinery parts, not containing electrical connectors, insulators, coils, contacts or other electrical features, not specified or included elsewhere in this chapter.;Outras pe‡as de maquin rios;f;1;1
8501;~X~1685;7;Electrical Machinery;"electrical machinery and equipment and parts thereof; sound recorders and reproducers, television image and sound recorders and reproducers, and parts and accessories of such articles";M quinas e aparelhos el‚tricos;f;1;1
8501;~X~168501;9;Electric Motors;electric motors and generators (excluding generating sets).;Motores el‚tricos;m;1;1
8502;~X~168502;9;Electric Generating Sets;electric generating sets and rotary converters.;Geradores e conversores el‚tricos;m;1;1
8503;~X~168503;9;Electric Motor Parts;parts suitable for use solely or principally with the machines of heading 85.01 or 85.02.;Partes de motores el‚tricos;f;1;1
8504;~X~168504;9;Electrical Transformers;electrical transformers, static converters (for example, rectifiers) and inductors.;Transformadores el‚tricos;m;1;1
8505;~X~168505;9;Electromagnets;"electro-magnets; permanent magnets and articles intended to become permanent magnets after magnetisation; electro-magnetic or permanent magnet chucks, clamps and similar holding devices; electro-magnetic couplings, clutches and brakes; electro-magnetic li";Eletro¡mÆs;m;1;1
8506;~X~168506;9;Batteries;primary cells and primary batteries.;Baterias;f;1;1
8507;~X~168507;9;Electric Batteries;electric accumulators, including separators therefor, whether or not rectangular (including square).;Acumuladores el‚tricos;m;1;1
8508;~X~168508;9;Vacuum Cleaners;vacuum cleaners.;Aspiradores de p¢;m;1;1
8509;~X~168509;9;Other Domestic Electric Housewares;electro-mechanical domestic appliances, with self-contained electric motor, other than vacuum cleaners of heading 85.08.;Outros eletrodom‚sticos;m;1;1
8510;~X~168510;9;Hair Trimmers;shavers, hair clippers and hair-removing appliances, with self-contained electric motor.;M quinas para barba ou cabelo;f;1;1
8511;~X~168511;9;Electrical Ignitions;"electrical ignition or starting equipment of a kind used for spark-ignition or compression-ignition internal combustion engines (for example, ignition magnetos, magneto-dynamos, ignition coils, sparking plugs and glow plugs, starter motors); generators (f";Aparelhos el‚tricos de igni‡Æo;m;1;1
8512;~X~168512;9;Electrical Lighting and Signalling Equipment;electrical lighting or signalling equipment (excluding articles of heading 85.39), windscreen wipers, defrosters and demisters, of a kind used for cycles or motor vehicles.;Aparelhos el‚tricos de ilumina‡Æo ou sinaliza‡Æo;m;1;1
8513;~X~168513;9;Portable Lighting;portable electric lamps designed to function by their own source of energy (for example, dry batteries, accumulators, magnetos), other than lighting equipment of heading 85.12.;Lanternas el‚tricas port teis;f;1;1
8514;~X~168514;9;Electric Furnaces;"industrial or laboratory electric furnaces and ovens (including those functioning by induction or dielectric loss); other industrial or laboratory equipment for the heat treatment of materials by induction or dielectric loss.";Fornos el‚tricos industriais;m;1;1
8515;~X~168515;9;Electric Lasers;"electric (including electrically heated gas), laser or other light or photon beam, ultrasonic, electron beam, magnetic pulse or plasma arc soldering, brazing or welding machines and apparatus, whether or not capable of cutting; electric machines and appar";M quinas el‚tricas a laser;f;1;1
8516;~X~168516;9;Electric Heaters;"electric instantaneous or storage water heaters and immersion heaters; electric space heating apparatus and soil heating apparatus; electro-thermic hair-dressing apparatus (for example, hair dryers, hair curlers, curling tong heaters) and hand dryers; ele";Aquecedores el‚tricos;m;1;1
8517;~X~168517;9;Telephones;"telephone sets, including telephones for cellular networks or for other wireless networks; other apparatus for the transmission or reception of voice, images or other data, including apparatus for communication in a wired or wireless network (such as a lo";Telefones;m;1;1
8518;~X~168518;9;Microphones and Headphones;"microphones and stands therefor; loudspeakers, whether or not mounted in their enclosures; headphones and earphones, whether or not combined with a microphone, and sets consisting of a microphone and one or more loudspeakers; audio-frequency electric ampl";Microfones e fones de ouvido;m;1;1
8519;~X~168519;9;Sound Recording Equipment;sound recording or reproducing apparatus.;Equipamentos de grava‡Æo de sons;m;1;1
8520;~X~168520;9;Dictation Machines;Dictating machine requiring external power source;Gravadores de voz;m;1;1
8521;~X~168521;9;Video Recording Equipment;video recording or reproducing apparatus, whether or not incorporating a video tuner.;Equipamento de grava‡Æo de v¡deo;m;1;1
8522;~X~168522;9;Audio and Video Recording Accessories;parts and accessories suitable for use solely or principally with the apparatus of headings 85.19 to 85.21.;Acess¢rios de grava‡Æo de  udio e v¡deo;m;1;1
8523;~X~168523;9;Data Storage;"discs, tapes, solid-state non-volatile storage devices, ""smart cards"" and other media for the recording of sound or of other phenomena, whether or not recorded, including matrices and masters for the production of discs, but excluding products of chapter";Dispositivos para arquivamento de dados;m;1;1
8524;~X~168524;9;Gramophone Records;Recorded gramophone records;Discos fonogr ficos;m;1;1
8525;~X~168525;9;Broadcasting Equipment;"transmission apparatus for radio-broadcasting or television, whether or not incorporating reception apparatus or sound recording or reproducing apparatus; television cameras, digital cameras and video camera recorders.";Equipamentos de transmissÆo de r dio e TV;m;1;1
8526;~X~168526;9;Navigation Equipment;radar apparatus, radio navigational aid apparatus and radio remote control apparatus.;Equipamentos de navega‡Æo;m;1;1
8527;~X~168527;9;Radio Receivers;reception apparatus for radio-broadcasting, whether or not combined, in the same housing, with sound recording or reproducing apparatus or a clock.;Receptores de r dio;m;1;1
8528;~X~168528;9;Monitors and Projectors;"monitors and projectors, not incorporating television reception apparatus; reception apparatus for television, whether or not incorporating radio-broadcast receivers or sound or video recording or reproducing apparatus.";Monitores e projetores;m;1;1
8529;~X~168529;9;Broadcasting Accessories;parts suitable for use solely or principally with the apparatus of headings 85.25 to 85.28.;Acess¢rios para transmissÆo de r dio e TV;m;1;1
